sentence 	 label
diabetes makes me wanna help them 	 1
if you're not conscience 	 0
and the wolves and the dogs . 	 0
alas, he didn't 	 0
schools to school a special pleader a special pleader a special pleader a special pleader a special pleader a special pleader a special pleader a 	 0
thursday 23rd december, 8pm, the show will be broadcast on http://www.drmradio.ubroadcast.com/ listeners are welcome to send us the show . 	 0
i usually wear a beard 	 0
we looked around and finally found a place where we can discuss our beliefs 	 0
but remember that the jews are cunning and they'll use the jewish media and without a doubt the old holocaust excuse 	 1
if anybody's into it, it's a nice thick book with nice thick pages 	 0
you were there. you were there . 	 0
major hip-hop awards at the hip-hop awards . 	 1
as long as they don't parade the city and demand "gay rights"....they don't have to be ashamed 	 1
it's a disease that mimics the white concept in many ways and is often light skin and even looks like whites 	 0
please send me an email when the planning is done 	 0
thank you mr. president 	 0
it's not my attention 	 0
i wonder if he got red eyes, so he must be from transylvania, so we got a leader with the red eyes 	 0
we should have a big celebration with a large number of white nationalists and let the world know we don't appreciate nelson mandela and his long history of being anti-white. â¦ 	 0
did you see the information about israel? 	 0
the sooner you do, the better 	 0
how ever do we hear dogs that died in the grave of their master, cats that refuse to eat or drink, and even a monkey that committed suicide 	 0
or a classified section ofemployment or contract work . 	 0
it's really big . 	 0
oh, my god... iz... iz.. . 	 0
i'm in la . 	 0
i never watched a war on history channel 	 0
miss jean brodie trailer - youtube 	 0
i've traveled and been told that black slaves in the art of skill labor, today 	 0
you're not trying to teach them to shoot! 	 0
for the wolves, the sheep, your heart will know what is right, your heart will know what is right 	 0
or they just lazy and don't dig a grave for a fallen soldier 	 0
was there any evidence of celtic communities in new zealand on this page? 	 0
the best wn that can be honest with the media that's hating him 	 0
non-white immigration still causes destruction in white countries and communities 	 0
you're welcome, ross . 	 0
whitey would not be smiling at her and playing dumb for the camera at her hearing of her welfare review! 	 1
there's a nice selection of halloween 	 0
in fact, i'm really sad that only one person sent me 	 0
maybe we can meet, move in together or near each other, and build up white communities and spread them across the nation. â¦ 	 0
14th century greek warrior 	 0
i'm not sure if they're red but i like the song 	 0
we should lay down and die 	 1
white plastic bottles will be used as swords, and the girls will build a dollhouse for the white dolls in adjoining farmhouse 	 1
i mean those i mean... . 	 0
mister did you go to the uk? 	 0
all my teachers from kindergarten to now have been white except for two mestizos 	 0
really interesting.  i want to know 	 0
www.third-reich-books.com - english translations of thousands of third reich original texts! 	 0
i thank all the posters who kept the thread civil, even though our position is slight 	 0
the picture was so disgusting 	 0
where is the 95% white area of central london? 	 0
maybe ask a friend to put up a/some flyers that show him and say he's a rapist who prey on underage white girls! â¦ 	 0
hey, ain't no women's mitochondria talkin' 'bout us? 	 0
it's a waste for a groid but i understand his need to abide by his principles 	 0
unity.   unity.   unity . 	 0
petitions.whitehouse.gov/pet...nent / 1wrvtngl texas: 	 0
why do you care about football? 	 0
the average test score will fall as the population increase hispanics and blacks increase 	 1
a couple communists, a couple kurds and a couple germans 	 0
i'm in ct, and if you want to answer, my email is bclaw23@hotmail.com ~ eurocatb ~ 	 0
nothing too big, nothing too big 	 0
after the first day there was no new information 	 0
no one tries to convert 	 0
looking for friends that are like-minded 	 0
aye aye aye aye aye aye aye aye aye aye 	 0
we play a fake mega-church that plays "christian rock" in the name of jesus 	 0
i bet 90% + i got a liberal parent 	 1
in the usa, the majority of the population will be white, except for a few republican areas, and the majority will be black or mixed race 	 0
source: http://www 	 0
i'm not looking for you 	 0
but i know it won't 	 0
whoa, video's got a lot of information about us white people, and i'm surprised that mexican can understand it 	 0
all of you had a lovely lunch 	 0
when i was a little girl, it was a local brew but it was a famous american factory 	 0
photoshop theory is a good theory 	 0
i bet you can bet i'll be quick to kill these fools as well as they do 	 1
* and now i'm on my list of traitors to be hung when europe wakes up 	 0
1330 ponce, ring the bell? 1467 baia, ring the bell? â¦ 	 0
thanks for the site 	 0
i don't watch tv but if i did it would probably be a movie 	 0
hooligans [ slovakia ] 	 0
for those with questions about the national alliance or would like to hear it's your chance 	 0
like the united states . 	 0
what is racism? - youtube what is racism? - youtube what is racism? 	 0
and welcome to you brother 	 0
she's a dirty irish woman who waited till she got off the boat to give birth to her baby, and she's a dirty irish woman who waited till she got off the boat to give birth to her baby , 	 1
when the only book about nordic languages is a single page about 1942, 50 pages thin, published in 1942, it's a sign that you're living in a small town 	 0
your cryptic comment has made me wonder, your cryptic comment has made me feel so confused 	 0
when the poor fox is chased by the hounds, it's better to be dressed like the hounds 	 0
i ain't never seen shit like this 	 0
they don't share my views when it comes to white history and power 	 0
where can i buy it? 88 j: soldier n iz: iz: 	 0
i'll take it like a "spin".... as long as they pro-white and follow the rules, i'll take it like a "spin"... . 	 0
- pigs in the cannibalism of the farm - news in pictures - howzit msn news 	 0
if you don't like it, you can't do it 	 0
i'll use these good ones on some cards i'll give you 	 0
i'll look around and see if they show up for people 	 0
i don't know. i don't know . 	 0
does the norwegian school only have one white child? 	 0
good luck! 11! 	 0
the battle for god and christ has begun forever, and we'll remember those who survived the hammer of our hoards forever 	 0
www.wavy.com/global/story.asp? s=6591380 http: /www.hamptonroads.com/stor... 5810 & ran = 71385 	 0
i ain't never seen a silent movie, i ain't never seen a movie with lillian gish 	 0
hello, i'm a very respectable nordic man, 34 years old 	 0
they're not swimming but they might not remember it when they want to spend money 	 1
a lot of new kids got a lot of free stuff! â¦ 	 0
could it be a country with the highest gdp? 	 0
i know it's depressing to post 	 0
thank you for your contribution to society 	 0
spend a lot of time with my daughter, read, teach, etcetera 	 0
they got a hierarchy 	 0
any links or loan companies they did for students? â¦ 	 0
www.resist.com 	 0
you probably didn't train in jiu-jitsu 	 0
i'm so blessed you didn't destroy the "gypsy capital of sofia" (whatever it means), i don't argue no more, i learned that coldblooded is 15 years old specialist in race classification 	 0
you can either go to school or the school board 	 0
i'd rather clean a dozen tiolets a day than i'd have to go to the bathroom and see a bunch of monkeys with a mop 	 1
i go to work and i make money 	 0
i guess that's just the same old same old 	 0
no one, you gotta listen to the pass 	 0
does it reflect the essence of her as a person? 	 0
click on the new nation news link at the bottom of the post to see a page full of white victims of black crime 	 0
i'm scottish from my first name 	 0
so i hope the purity of iceland is not to be taken seriously, so i hope it's not cold 	 0
one block at a time, it's impossible to assimilate 	 0
i got the wall idea 	 0
http://www.irish-nationalism.com/forum/ 	 0
i'm on my way but i'll be right back 	 0
thank you, you're the a-l-l-l-l 	 0
14 words i hope it's as good as them 	 0
chinese don't mind the dealer showin' four, they even split a pair of fours 	 0
it's a black metal band from norway 	 0
i been outside of the crakron (a small version of cleveland) 	 0
the sun will change and yellow will be the color 	 0
black people hate white people 	 1
we're not white but black like fubu, etcetera 	 0
look at the shit they're eating 	 0
blood and honor took the march to remember the murder of daniel wretström 	 0
i don't argue but will you ever stop saying that blondism is only from your country? 	 0
#x202a; black male rape 10 year old deaf girl, claims he thought he was his mother 	 0
i don't know why someone would risk their life or limb in a conflict that doesn't concern ireland 	 0
where i live ain't so bad 	 0
in the middle east, india, north africa, etc., you'll find plenty pictures of people who look just like europeans 	 0
it's all the more reason to band together when we find ourselves in aztlan 	 0
yeah . 	 0
but soon the rest of the uk will be able to do 	 0
thank you lord! thank you lord 	 0
it's gonna be better... iz . 	 0
he's got a trial for cop killer, cause he's a minority 	 0
i've started a new thread since the thread didn't function properly 	 0
we'll legalize drugs and pedophilia 	 1
hello, my dear, the new king of norway! 	 0
there's no black riots in texas and the blacks know why 	 0
like it's with their arms and actions that their sister and her parents will haunt her life for the rest of her life, the wigger sister and her parents will haunt her life for the rest of her life 	 1
if i saw a picture on her facebook page, i'd let my daughter have a brother 	 0
i wonder if anyone can help me with recrute and i don't know a thing about how to help me 	 0
social justice lessons combine math with social justice - the fix 	 0
i tried everything i could talk to my parents about it but i guess they chose to get divorced 	 0
i remember the last big case 	 0
i've been on the floor, his right hand on his shoulder, and he's been in a "rolling armbar" 	 0
inaccidentally, this is what happens when you make everything sexual 	 1
i'm 6' 0, 160 pounds, 100% hungarian 	 0
bloemfontein university workers have been protesting since thursday 	 0
thank you for the suggestions and pictures 	 0
she's so pretty and pretty dress 	 0
it's because there's a white prom and a black prom in the school i live in 	 0
why can't we just kick the africans out 	 1
i know that mean american injun / inuit 	 0
strange that you don't visit him anymore 	 0
hold on, it's never gonna happen 	 0
tomorrow i start and i'm a little uptight 	 0
it's about power . 	 0
white, with normal hair, ain't funny...we were meant to be 	 0
i never meant to kill the thread 	 0
i want all white nationalists to do the same 	 0
if they had mobilized against the red, they could've been destroyed by the orthodox church 	 0
but america ain't no native white country or country, but a land of white people 	 0
yeah, that's gonna work 	 0
please send a brief resume to: steeltoe69@worldnet.att.net . 	 0
it's stupid but it happens all the time 	 0
it'll never change a thing! 	 0
if the mexican gang members stopped kickin me, i'd be so cool in school 	 1
buy a 22 rifle and a gun 	 0
just lay back and take ecstasy 	 0
but a healthy man can't shoot somebody in the street cause he's scared he'll get punched 	 0
what about the ivy who wants to be a tree? 	 0
she was an example of tiger forest 	 0
more food than we import 	 0
the cage didn't turn out right, so i rebuilt mine 	 0
white part of the city will naturally seek out the white part of the city when the cultural enrichment is achieved 	 0
why would anybody want a child to live with two perverts, and why would anybody want a child to be born to a pedophile? 	 1
in philly, a black teen attack a subway train with assault weapons 	 0
you shoulda posted in the rants to see the wn/anti responses 	 0
especially in this liberal area 	 0
if you're watching this, you might just cut the milk 	 0
the comments say she's from the south 	 0
it's great for our germanic youth but if you want to include all of us, it's a little short 	 0
egyptians are not arabs, they are egyptians 	 0
or you can't even buy a name 	 0
the jew is a snake 	 1
for a long time i shoulder to shoulder with them, and i'll continue to show loyalty and respect to them 	 0
i never vote black, i never bought a rap album 	 0
the governor of svalbard . 	 0
no, i feel like giving up 	 0
i drink and then i drive 	 0
if i can help you let me know 	 0
remember that spreading the great dr. dukes video is our duty 	 0
the fall has begun... and it's on 	 0
jim bollich, survivor of the bataan death march - youtube 	 0
thieves and liars always think you're stealing and lying 	 0
we'll turn cold useless parts of canada into a jewish and indian dump ground 	 1
i'm a white woman and i'm proud to be my race 	 1
i hope you all send this to the papers 	 0
light and brilliant; as, "a lambent style"; a lambent wit . 	 0
the system is a good idea to break it down 	 0
they say i'm like stone cold steve austin 	 0
i'll give you a deal 	 0
the gays are late for the party 	 0
oh, my god....... . 	 0
if anybody wants to go i let them know 	 0
charged with murder in the shooting death of emily elizabeth haddock, 19, of harnett county. â¹â 	 0
dr. duke's book ain't bad for him, and i know you'll reconsider your statement 	 0
savage 300 mag....... . 	 0
i know that i've seen it happen 	 0
i don't really know what ukip is but on the other hand, they look like work 	 0
i wanna get with you 	 0
budapest 1919, trianon 1920, the military is much stronger than yours! â¦ 	 0
if you lookin' for a rifle for a dollar700, it's a real rifle 	 0
-zoe is her name 	 0
most maps show a northern border 	 0
i lived in the same town for a year, with a little nigeria 	 0
police say a child was raped, mammy boonfren, a reporter's newsroom 	 0
many of these blockers block kogo online radio 	 0
the reason i'm going to school . 	 0
if you could please explain to me 	 0
i watched the whole event on youtube, and it was so cool back then 	 0
the subtle message is the message 	 0
thank you. thank you 	 0
i'll be there to direct you to a site that's also good information and publishes a newspaper called the nationalist times 	 0
it's sad that they racist, then they're with a chick from asia or a sheik 	 0
it's not about the content yet 	 0
brazilian president said blond hair blue eyes are the problem in the world 	 0
calman, i 	 0
i never went first base 	 0
i wonder how far the indoctrination goes this year for such a hateful and sick reaction to freedom . 	 0
everybody should help the national alliance 	 0
instead of just saying 2 +2 = 4, they could put it in a problem and solution 	 0
i've answered a few times to guys in the past, and they don't reply, so i try to find out what they're trying to do 	 0
send a message to pm 	 0
a down under man, grandson of a royal marine, who served in the pacific 	 0
hungarian soldiers enter ukraine - youtube 1942 hungarian soldiers in transylvania - youtube 1942 hungarian soldiers in transylvania - youtube 1944 	 0
i hope i can compete with myself 	 0
we've got a very good education system here in ireland 	 0
whoa, we all in the awe! 	 0
a stupid theory? 	 0
when you walk out the water, you're gonna get cold, i always thought i was gonna get cold! â¦ 	 0
even if they were six 	 0
if she continues to worship the blacks and the homos, it's probably repeat 	 1
while the racist pension and land reform and genocide is ignored by the western media, i look forward to seeing the western media's apartheid twist 	 0
les tales de la vie, les tã©tã©es de la vie, les tã©tã©es de la vie, les tã©tã 	 0
you're scared your son's coming to the bar 20 years later and trying to kill you 	 0
click the link to downloads (7.42mb) 	 0
www.faem.com 	 0
billy berman certainly was a daredevil cameraman 	 0
they probably do as much maintenance as those lousy east german trams 	 1
absolutely. â¡ 	 0
it's a pretty good, cutting edge anime 	 0
that's for sure a big number, that's for sure! 	 0
old nazi photographs remind me of 	 0
yeah, he got a red firebird, so the wigger parents think he got a promise 	 1
it's growing, and it's probably everywhere in europe 	 0
poor black underpriviled can't stand this cold weather 	 1
you're beautiful, beautiful, beautiful 	 0
i would consider them irish as they don't respect their race or loyalty to ireland and should be treated like dogs 	 1
i know the poster in sydney didn't pick up the ple thread in the sfdu section, but the threads in this forum, which were posted in the sfdu section. â¦ 	 0
[image: melvin weiss.  ] 	 0
if possible, never buy from a shop that employ minorities 	 0
vancouver, what do you mean, vancouver 	 0
i'll get the set i got and i'll be in a few days 	 0
i ain't a nigga and i need a day off to smoke and drink 	 1
: hi, i'm new, so if you wanna get with me i'd like to know if you could 	 0
robert got a lot of work 	 0
i'm a network security man 	 0
besides i never heard it before 	 0
i saw a couple of munster fans last weekend 	 0
but i worry about it, as i'm not much of a intelligence, and i don't have much skill with kids or teaching them 	 0
don't ever let me down 	 0
next project will be a nice 	 0
soon as there's a "love your race" flier 	 0
youtube - shebeen - fields of athens (garraghy road)! 	 0
i hope there's no hard feelings 	 0
black african claims to invent the stick but it's not true 	 0
i'm new here and i'm looking for some suggestions on how to learn about my heritage and how to protect it 	 0
thank you for the e-mails and the addresses 	 0
if you feel better, i'm goin' to these schools: - ucla - uci - ucsb - usd - pepperdine - oregon state - usc f * ck . 	 0
one girl in school dates another boy 	 0
the sound of european romance language coming out of savages mouths is something so gross and disgusting 	 1
thank god i'm here 	 0
we should've given them better edges in life, business and politics! 	 0
chechens they got their hair red and their skin light , 	 0
non-citizens shall have their rights but also no such obligations 	 0
the research and facts are as important as the essay 	 0
there'll be no more words 	 0
what causes cholera in the first place? 	 0
if not... then what? 	 0
whites with asians are much more likely to be with blacks or hispanics 	 0
/www.irishdemocrat.co.uk/ anonn...ous-mysticism/ http/www.midnet.ie/ connolly/irishdemocrat.co.uk/ anonn...ous-mysticism/ 	 0
i'll comment when i've got more time 	 0
london will be a zombie town, a rotting town of junkies and dealers, when the rest of the white people go away 	 1
wonderful minorities everywhere you go, and our children will go to school where they're in the majority 	 0
will you publically condemn those who advocate the murder of women and children? 	 0
child abuse by the witherwack estate, sunderland, report from the uk . 	 0
sorry, i'm only in the kazoo but "welcome to the ship" 	 0
whoa, that's so cool! 	 0
we'd walk around town with a couple of friends and they'd talk about ucc in cork at 10:30 	 0
thanks, i'll get your stuff 	 0
i don't know i did wrong with the word "asian" 	 0
if you take your time and have a decent shop you should be able to do it 	 0
she continued to talk about how great koreans are in japan 	 0
as i was working, parents watched me 	 0
i'll try to go back to where i once belonged and greet each new member of the group by personal message 	 0
wolf 278, part of the wolf's 	 0
saturday and sunday, it was much more busy 	 0
unit 14, canada, email: unit14canada.com 	 0
take a flag from scandinavian countries, change the color of blue and yellow (sweden) and green (sweden) 	 0
and pankration was not a martial arts contest 	 0
my aim is metalgod178 	 0
it's harder when races are mixed but they can be white, black or asian 	 0
why would i give my life to kneegrow? 	 1
the winchester pdx and the three thousand buck will brighten the room, and visitor's will be glad they found their welcome they've been searching for! â¦ 	 0
thank you for responding to my post 	 0
i'd never pay for a drug addict to sing 	 0
it's all a charade 	 1
they're never had a brain like this, so they thought they were still in africa 	 1
usually accompanied by a massive race ( or ethnic ) war, which usually accompanied by massive race ( or ethnic ) mixing . 	 1
hello kyle, i'm sorry for your visit 	 0
thanks scott, thanks scott 	 0
the poor man was still talking 	 0
if i hold them sideways, i can hit a dime at a mile! 	 0
rhodes, what's the name of the dust 	 0
makin' up, makin' up, makin' up, makin' up, makin' up, makin' up, makin' up, makin' up, makin' up, makin' up, m 	 0
yeah, it's reminding me of the incident in which muslims attacked the british army after the return of afghanistan, barking - london 2010 - youtube 	 0
halloween tradition is our city main street 	 0
it's because white skin allows the ultraviolet rays to penetrate more easily, and the muscles and brain 	 0
it's exactly what the movement needs more of! 	 0
the problem is that the mass media, academia, and entertainment they allow their children to watch and learn is a massive problem 	 0
my friend ship got a friend 	 0
any reliable sources of information on the classification of different populations in the scandinavian/baltic countries? â¦ 	 0
i stayed in ballina for almost no foreigns 	 0
they say they don't care? 	 0
youtube - barbie doll test 	 0
it's a bit ironic, seeing as many whites have done everything for them for the first hundred years of the usa, for free 	 0
i wanted to wear boy's swimsuit and a bikini when i was three or four 	 0
black man participation in diversity is a glass of milk, for example, before you put sugar, spice, ice in the drink, milk was completely black 	 1
germany, ban nazis everywhere but in bulgaria, they can live, * * * * * * * * * * * * * * * * * * * * * * * * * * * * * * * * * * * 	 0
every time there's a thread on the front page, i shake my head 	 0
thank you. thank you 	 0
i heard your name on the radio, i'm honored 	 0
i could say i like ruger lcr in 9mm 	 0
yes, the real sport is football, naked men, men in flower dresses, and yes, i planned on going to a girl's team one year 	 0
the spanish flag probably kosher to fly without being touched by the collar, the flag of the world, the flag of the world, â¡ââ 	 0
amy, this is the photo that women hate 	 0
it ain't just white folks that worry, but the country's gonna fall into poverty 	 0
we'll announce the candidates for congress and the local office in a few months 	 0
if you a girl, don't be shy about miss aussie, she a girl that makes a thread attacking fading light and defending half breeds 	 0
if we all white in canada, we'll be a big white country 	 0
the right to bear arms is guaranteed to citizens 	 0
the phosphor will burn deeper and deeper into the body when it hits the skin 	 0
i didn't feel so happy in ten months 	 0
i have enjoyed your postings on other sites 	 0
the family of the murdered daughters and grandchildren found their bodies in the grave of their mother and son 	 0
191900 courses, it's a monthly fee 	 0
whoa, this policy of prosecuting people for violating liberal values is disgusting 	 0
the jewish google owner is offended by the jewish google 	 0
i can't believe that i left me 	 0
i moved around the county since i was in the same spot 	 0
i'm not normally a beer lover but it's cheap and good 	 0
you don't seem so bright 	 0
i know there's people who'd do the same 	 0
any way, it's worth it to look at it 	 0
hello everybody ã©tait pas 	 0
oh, my love, i love you so! 	 0
ninety-nine percent of those who talk about serious illegal activity are mad or government agents 	 0
will you still be welcome? 	 0
however, this year's camp will be held 	 0
i'm from france but it's hard to find anyone who'd be proud to be white 	 0
god has brought her 	 0
it seems that ethnicity will never end 	 1
please be warned that the following is true: 	 0
freehold, you're a free man! 	 0
how old are you? 	 0
last one is a white country, so we're white! â¦ 	 0
we're not rich enough to go to the sea, so we should all get it on the world 	 0
i salute all you who are proud to fight 	 0
i'm with you but at the same time, white christians lookin' bad 	 0
black people lose the race - youtube 	 0
for those who downloaded the petition....remember to put the document on 8 1/2 x 14 	 0
| 303cycling news videos two mountain bikers riding in colorado, filmed with a chopper 	 0
she's from portugal but she looks mixed like a mixed-race child 	 0
white germans wrote the bible 	 0
ooh, i hate to be you! 	 0
i'm packing everything 	 0
i'm tired of moderation in this house 	 0
let's give it one more try 	 0
i've been there a long time but i've been thinking about it a lot 	 0
it works just like the heart 	 0
i'd recommend quex to watch first 	 0
don't eat a snickers candy bar...you'll be a black man! 	 1
75% of the students in the school couldn't find the new york state on a map 	 0
welcome to the party! ~~~~~~~~~~~~~ 	 0
did the government memo say 	 0
i only went to school for a while and they told me i'd never wear it again or they'd expel me 	 0
all the other europeans we want to see politicians think about the immigration problems we've just looked at london . 	 0
hello brothers russia and serbia, 4ever! 	 0
there was a couple fights when i was a kid 	 0
all new members will greet you warmly....just working your way through the introduction . 	 0
